{
  "schema": "gis-ai-go.execution-result.v1",
  "request_id": "exec-202-example",
  "operation": "fixture.features.query",
  "status": "succeeded",
  "trace": {
    "traceparent": "00-4bf92f3577b34da6a3ce929d0e0e4736-00f067aa0ba902b7-01",
    "tracestate": "gis-ai-go=synthetic"
  },
  "data": {
    "type": "FeatureCollection",
    "crs": "EPSG:4326",
    "axis_order": "longitude-latitude",
    "features": [
      {
        "type": "Feature",
        "id": "SYN-001",
        "geometry": {
          "type": "Point",
          "coordinates": [-1.5, 52.4]
        },
        "properties": {
          "native_id": "SYN-001",
          "name": "Synthetic Alpha",
          "category": "synthetic-place"
        }
      },
      {
        "type": "Feature",
        "id": "SYN-002",
        "geometry": {
          "type": "Point",
          "coordinates": [-1.9, 52.48]
        },
        "properties": {
          "native_id": "SYN-002",
          "name": "Synthetic Bravo",
          "category": "synthetic-place"
        }
      },
      {
        "type": "Feature",
        "id": "SYN-003",
        "geometry": {
          "type": "Point",
          "coordinates": [-3.18, 51.48]
        },
        "properties": {
          "native_id": "SYN-003",
          "name": "Synthetic Charlie",
          "category": "synthetic-place"
        }
      }
    ]
  },
  "evidence": {
    "schema": "gis-ai-go.execution-evidence.v1",
    "input_sha256": "sha256:a217e95152914ae98fd1e76c49ac662018e937135e50a45ebcb08f6ffa983831",
    "output_sha256": "sha256:da8a91b7d0c2f118672e9be30bb0a91c968244debabab25bfe3a2e1f64dacba7",
    "feature_count": 3,
    "source": {
      "provider_id": "gis-ai-go.synthetic-fixture",
      "dataset_id": "synthetic-gb-places",
      "version": "1.0.0",
      "rights": "CC0-1.0",
      "source_uri": "urn:gis-ai-go:fixture:synthetic-gb-places:1"
    },
    "transformation": {
      "operation": "synthetic-point-in-polygon-v1",
      "source_crs": "EPSG:4326",
      "source_axis_order": "longitude-latitude",
      "output_crs": "EPSG:4326",
      "output_axis_order": "longitude-latitude",
      "geometry_repair": "none",
      "geometry_simplification": "none"
    },
    "software": {
      "name": "gis-ai-go-execution",
      "version": "0.1.0",
      "algorithm": "synthetic-point-in-polygon-v1"
    }
  }
}
